{
  "$schema": "http://json-schema.org/draft-07/schema#",
  "$id": "https://tradeops.local/schemas/events/surveillance/surveillance.alert.created.v1.json",
  "title": "surveillance.alert.created v1",
  "type": "object",
  "additionalProperties": true,
  "required": ["alertId", "alertType", "severity", "status"],
  "properties": {
    "eventType": { "type": "string", "enum": ["surveillance.alert.created"] },
    "eventVersion": { "type": "string" },
    "eventId": { "type": "string" },
    "tenantId": { "type": "string" },
    "correlationId": { "type": "string" },
    "traceparent": { "type": "string" },
    "occurredAt": { "type": "string", "format": "date-time" },
    "source": { "type": "string" },
    "alertId": { "type": "string" },
    "alertType": { "type": "string" },
    "severity": { "type": "string" },
    "entityType": { "type": "string" },
    "entityId": { "type": "string" },
    "userId": { "type": "string" },
    "symbol": { "type": "string" },
    "status": { "type": "string" },
    "metadata": { "type": "object", "additionalProperties": true }
  }
}
