{
  "eventId": "66666666-6666-4666-8666-666666666661",
  "eventType": "surveillance.alert.created",
  "alertId": "77777777-7777-4777-8777-777777777771",
  "alertType": "LargeOrderRule",
  "severity": "HIGH",
  "entityType": "ORDER",
  "entityId": "88888888-8888-4888-8888-888888888881",
  "userId": "33333333-3333-4333-8333-333333333333",
  "symbol": "AAPL",
  "status": "OPEN",
  "metadata": {
    "notional": 150000,
    "threshold": 100000
  },
  "occurredAt": "2026-06-08T11:00:00Z",
  "correlationId": "demo-correlation-123"
}
